{
  "schema": "offline-tarteel.promotion.v2",
  "run_id": "task-048442117107-20260509T061129Z",
  "git_sha": "7b4c04b344129c011f009fd68245f5aa71479e96",
  "promoted_at_utc": "2026-05-09T06:11:29.231622+00:00",
  "packages": {
    "core_version": null,
    "sdk_version": null
  },
  "reports": {
    "tier1_report_path": "/workspace/artifacts/tier1/tier1-20260509T061129Z.json",
    "tier3_report_path": "/workspace/artifacts/tier3/tier3-20260509T061129Z.json"
  },
  "artifacts": {
    "onnx_sha256": null
  },
  "compatibility": {
    "reference_repo_min_sha": null,
    "node_major_min": 20,
    "requires_ffmpeg_tier1": true
  },
  "gates": {
    "corpus_qa": true,
    "tier1_onnx_recommended": true,
    "tier3_browser_required": true,
    "blind_corpus_non_regression": null
  }
}